{
  "$schema": "http://json-schema.org/draft-07/schema#",
  "$id": "https://raw.githubusercontent.com/RebelliousSmile/schema-in-the-mist/v1.2.0/schemas/v1/city-of-mist/danger.schema.json",
  "type": "object",
  "properties": {
    "name": {
      "default": "Untitled Danger",
      "description": "The name/title of the Danger.",
      "examples": [
        "Carlton Cooper",
        "City Official",
        "Automated Security System"
      ],
      "type": "string",
      "minLength": 1,
      "pattern": "\\S"
    },
    "description": {
      "description": "Brief MC-facing summary of what this Danger is and how it threatens the crew. Supports inline Markdown.",
      "examples": [
        "Enforcers are based on the Hired Thugs Mundane Danger with the addition of the **Juiced Up** move, which represents their enhanced physical state.",
        "The detective may be working against the crew, helping the crew, or she may be a rival of the crew. Adjust the {corrupt:} and {override-authority:} spectrums accordingly."
      ],
      "type": "string"
    },
    "rating": {
      "default": 1,
      "description": "General estimate of how dangerous this profile is (0-5).",
      "examples": [
        0,
        1,
        3,
        5
      ],
      "type": "integer",
      "minimum": 0,
      "maximum": 5
    },
    "spectrums": {
      "description": "Define how the Danger can be overcome, transformed, countdown toward an end, or ignore certain approaches.",
      "type": "array",
      "items": {
        "type": "object",
        "properties": {
          "name": {
            "type": "string",
            "minLength": 1,
            "pattern": "\\S",
            "description": "Action to undertake in order to overcome the Danger or to transform it meaningfully.",
            "examples": [
              "hurt",
              "outsmart",
              "ticking",
              "burn"
            ]
          },
          "maximum": {
            "default": 1,
            "description": "Tier that relevant statuses need to reach in order to overcome the Danger or to transform it meaningfully.",
            "examples": [
              3,
              4
            ],
            "type": "integer",
            "minimum": 1,
            "maximum": 6
          },
          "is_immune": {
            "default": false,
            "description": "If true, the Danger ignores statuses targeting this Spectrum's vector.",
            "examples": [
              false
            ],
            "type": "boolean"
          },
          "is_countdown": {
            "default": false,
            "description": "If true, this Spectrum advances toward an outcome rather than representing a way to defeat the Danger.",
            "examples": [
              false,
              true
            ],
            "type": "boolean"
          },
          "on_max": {
            "description": "Outcome triggered when a countdown Spectrum reaches its maximum. Supports inline Markdown.",
            "examples": [
              "The last verse is sung and the chorus becomes real."
            ],
            "type": "string"
          }
        },
        "required": [
          "name"
        ],
        "additionalProperties": false,
        "description": "Tracks how much of a given type of status a Danger can take before it changes irrevocably."
      }
    },
    "soft_moves": {
      "description": "Describe the actions the Danger can take to complicate the scene without direct rules impact.",
      "type": "array",
      "items": {
        "type": "string",
        "description": "Predefined variations of the soft MC move Complicate Things. They describe an action the Danger can take to complicate things which changes the story without affecting the rules directly."
      }
    },
    "hard_moves": {
      "description": "Describe the actions the Danger can take which have direct mechanical impact.",
      "type": "array",
      "items": {
        "type": "string",
        "description": "Predefined variations of the hard MC moves which can be invoked when the MC makes a hard move using the Danger specifically."
      }
    },
    "custom_moves": {
      "description": "Condition-plus-outcome rules for special abilities or circumstances.",
      "type": "array",
      "items": {
        "type": "object",
        "properties": {
          "name": {
            "description": "Short title for the custom move. Optional when the move is written as a single untitled rule.",
            "examples": [
              "Ultimate Predator",
              "Bodyguard",
              "Made of Clay"
            ],
            "type": "string",
            "minLength": 1,
            "pattern": "\\S"
          },
          "description": {
            "type": "string",
            "minLength": 1,
            "pattern": "\\S",
            "description": "Concise text that explains both the conditions that trigger the custom move and its outcomes.",
            "examples": [
              "When the Golem of Prague enters the scene, give it {hardened-skin-1}.",
              "When you try to get into the castle of the Sleeping Beauty, you first take {entangled-3} or {nick-and-cuts-2}, MC's choice."
            ]
          }
        },
        "required": [
          "description"
        ],
        "additionalProperties": false,
        "description": "A custom and unique condition-plus-outcome rule tailored to a specific ability or circumstance regarding the Danger."
      }
    },
    "meta": {
      "description": "Attribution and cataloging fields for the Danger's origin.",
      "type": "object",
      "properties": {
        "publication_type": {
          "default": "homebrew",
          "description": "Classifies the Danger's source to aid cataloging and tooling.",
          "examples": [
            "official",
            "cauldron"
          ],
          "type": "string",
          "enum": [
            "official",
            "third_party",
            "cauldron",
            "homebrew"
          ]
        },
        "source": {
          "description": "Source title (book, supplement, PDF) where this Danger appears.",
          "examples": [
            "City of Mist: MC Toolkit",
            "City of Mist: Shadows & Showdowns",
            "Lantern in the Mist - Sample Dangers"
          ],
          "type": "string"
        },
        "authors": {
          "description": "List of credited authors or contributors.",
          "type": "array",
          "items": {
            "type": "string",
            "minLength": 1,
            "pattern": "\\S",
            "description": "One credited author name.",
            "examples": [
              "Son of Oak",
              "4rtamis"
            ]
          }
        },
        "page": {
          "description": "Page number (if relevant to the source).",
          "examples": [
            112,
            126,
            394
          ],
          "type": "integer",
          "minimum": 1,
          "maximum": 9007199254740991
        }
      },
      "additionalProperties": false
    }
  },
  "additionalProperties": false,
  "description": "City of Mist - Danger profile, representing a threat, obstacle, victim, hazard, or group with spectrums and danger moves."
}
